,Title,Authors,Publisher,DOI,URL,Abstract,Eligibility_Score
89,Digital Technology Meets Ethics: How to Think About the Global Good When You are Changing the World,A. Renda,ieee,10.1109/Transducers50396.2021.9495741,https://ieeexplore.ieee.org/stamp/stamp.jsp?arnumber=9495741,"Innovation and digital technology are changing the world every day, bit by bit. Innovations in domains like the Internet of Things and Artificial intelligence are our best bet for sustainability and prosperity, and our reliance on them (especially after the pandemic) cannot be overstated. At the same time, these technologies must be handled with care, since they can lead to concerns and risks related to discrimination, excess energy consumption, problems with safety and security. This talk shows how governments around the world are trying to embed sustainability and ethical alignment in the policy framework for digital technologies: an endeavour that critically requires dialogue with the innovation community.",0.07476635514018691
90,Challenges facing AI and Big data for Resource-poor Healthcare System,A. Kaur; R. Garg; P. Gupta,ieee,10.1109/ICESC51422.2021.9532955,https://ieeexplore.ieee.org/stamp/stamp.jsp?arnumber=9532955,"During the last decade, major advancements in the health-care system have developed by offering numerous benefits to the patients throughout the world but resource-poor countries are not benefited through the best practices of health-care due to the lack of educated health-care providers, infrastructure, financial and technical issues, etc. Health-care systems in resource-poor countries face many challenges including increased healthcare cost, patient safety, overtreatment and failure to adopt best practices for health-care. In such countries, massive data generate from various resources including medical imaging, patient record, pharmaceutical reports, and medical devices. The exponential growth in medical data and advancement in health-care technologies focus data analysts to come up with innovative solutions for improving health-care practices in poor countries. Big data analytics provide tools to collect manage and analyze structured and unstructured medical data to find useful insights. Complexity and volume of medical data also show that, Artificial intelligence (AI) has the ability to approximate conclusions without direct human input, which can be applied in the health-care system of resource-poor countries and is now being utilized to further develop health services in high-income countries. Numerous investigations show that, AI performs better than humans in certain health-care undertakings such as diagnosis of cancer, tumor, heart diseases, radiology, etc. Popular AI techniques include machine learning methods such as neural network, support vector machine, and deep learning for structured data as well as natural language processing for unstructured data. There is a variety of hurdles around the use of big data and AI in health-care includes regulation, permission, transparency, and accountability. Also, the collection of data from an individual-a prerequisite for big data analytics is a technical and ethical issue. There are a lot of challenges for AI and big data in health-care but efforts need to be made before these techniques can be deployed in ethical and safe way. In this chapter, we discuss the challenges that AI and big data techniques face in resource-poor health care system and how it can be used to improve health outcomes in resource-poor countries.",0.07418397626112759
91,Towards User Online Security and Privacy Protection,J. Silaa; M. Morolog; A. Gamundani; F. Bhunu-Shava,ieee,,https://ieeexplore.ieee.org/stamp/stamp.jsp?arnumber=9577017,"ICT end-users are trapped in the dilemma of online freebies as some online services run background data mining algorithms to harvest usage patterns, behaviours, and other relevant personal attributes. Such end-user digital footprints are fertile grounds for security and privacy attacks. Therefore, trade-offs between user privacy and data security are hard to dissect. In this paper, we revisit these issues as revealed by the workshop conducted at the Namibia Internet Governance Forum (NamIGF) in 2019. The workshop hinted at the need for supportive legislative frameworks for the ethical adoption of recent technologies towards addressing dynamic challenges on security and privacy attacks. Participants’ perceptions, experiences and practices signalled the role of end users in shaping a national cyber security culture and policy development. Finally, a supportive legislative framework that could adopt the Quadruple Helix model to address these socio-technical issues pertaining to online user security and privacy challenges is recommended.",0.0738255033557047
92,Clustering Approach to Anonymize Online Social Network Data,R. Gangarde; A. Sharma; A. Pawar,ieee,10.1109/ICSCDS53736.2022.9760742,https://ieeexplore.ieee.org/stamp/stamp.jsp?arnumber=9760742,"OSNs (Online Social Networks) link billions of people to offline activities. OSNs have recently undergone significant development with increasing users every day. These networks are now an essential partner for individuals, but their online companions now play an unquestionably important role with expanding internet users. Users connect with other users who have overlapping personal trajectories after establishing confidence. OSN and other comparable programs extract massive amounts of data from individuals. As a result, data owners profit from this data, including personal information, sharing it with ethical third parties such as marketers. Unauthorized users can utilize data for unethical goals, resulting in various attacks and illicit uses of data. In this case, it is necessary to anonymize users' data before sharing it with others. Clustering users and anonymizing data set in a way that will not isolate individuals from the group. By failing to form tighter and k-anonymized clusters, one can track a person and perform illegal activities such as theft, robbery, and persona profiling. Anonymization protects personal information from prying eyes. However, data loss occurs as privacy increases, decreasing data utility. Hence, balancing privacy and utility is an open research issue.",0.07329842931937172
93,Privacy Computing Issues in Collecting and Using Customer Data of Mobile Devices,D. Q. Ren; H. Liu,ieee,10.1109/ICSIP55141.2022.9886951,https://ieeexplore.ieee.org/stamp/stamp.jsp?arnumber=9886951,"Merchants through smartphones and mobile applications measure and analyze users’ interests and behaviors, and identify users in applications and browsers to push services, updates, and advertisements to the users. This way of providing personalized services to smartphone users to attract potential customers has improved the user experience, created new opportunities for advertising, and changed the marketing trend of enterprises. However, the collection, processing, and analysis of user personal data has brought serious privacy issues to individuals and organizations. This paper introduces privacy risks, including user information collection and analysis of information flow between networks, analysis procedures and standards. Discussed the challenges of protecting user privacy, including privacy threats brought by user information and analysis, extraction, and exchange of private information between various advertising entities, privacy threats tracked by third parties, privacy information and related privacy issues. Next, based on these technologies, related underlying architecture, privacy mechanisms, and deployment scenarios, several technologies, and various suggestions for protecting user privacy are analyzed. Finally, the respect for people, regulations and laws, the limitations of technical solutions, ethical principles and moral dilemmas were discussed.",0.07222222222222222
94,Being Proactive for Responsible AI: Analyzing Multiple Sectors for Innovation via Systematic Literature Review,L. J. Wiese; D. S. Schiff; A. J. Magana,ieee,10.1109/ETHICS57328.2023.10154947,https://ieeexplore.ieee.org/stamp/stamp.jsp?arnumber=10154947,"Background: Questions surrounding the ethics of artificial intelligence (AI) have been debated for decades [1]. However, in recent years there have been multiple initiatives, scholarly reviews, and policy documents to identify and define ethical issues in play [2]. The efforts to bring high-level principles to applicable practice are complex and can be lost in translation [3]. Moreover, a call to be proactive, rather than reactive, stems from a deduction of intentions behind responsible innovation, value-centric design principles, education efforts, and representative data management techniques. Contemporary applications of AI are complex and difficult to explain, edit, and deal with once integrated in a natural system [4] [5]. Therefore, the analysis conducted within this systematic literature review (SLR) will clarify methods to promote and engage practice on the front end of ethical and responsible AI. As such, the research question is explored: How does each helix in the Quintuple Innovation model address responsible and ethical AI technology with anticipatory or proactive approaches? Methods: To conduct this ongoing research, an adaptation of the PRISMA framework and Hess & Fore's 2017 methodological approach guides the SLR [6] [7]. We included journal articles that were written in English and published between 2018-2023. The collected studies aim to examine how academic scholarship approaches to responsible AI within academia, government, industry, civil society, or the natural environment (the Quintuple Helix). The Web of Science, Google Scholar, and PhilPapers databases were used to identify a set of prominent publications in this field: AI & Society, Nature Machine Intelligence, Minds and Machines, IEEE Transactions on Technology and Society, AI and Ethics, Science and Engineering Ethics, and Communications of the ACM. A key limitation of this study is that it cannot gather the entirety of literature written about the topics of proactively promoting ethical AI due to the vast size and definitional complexity of the associated fields. These inclusion criteria allow the researchers to manage the data and draw meaningful insights from the most current thinking that is reflected in the rapid development of AI innovation we see today. Results and discussion: This poster will present preliminary results and the theoretical framework that guided the qualitative coding process. Additionally, this poster will serve as a forum to collect experts' opinions about what they would like to see from this SLR dataset, and how we can incorporate those elements into our coding. As a result, this data will be able to inform future work to investigate multiple gaps in the literature. For instance, U.S. Government work not protected by U.S. copyright this study will result in a theoretical framework that identifies proactive approaches to responsible and sustainable AI aligned with the five sectors for innovation. Inspired from [8], the effects of investments in education, and other sectors, will be mapped as a chain of responsible AI innovation across all innovation sectors. Finally, we can draw informed conclusions about the use and misuse of experts in AI, ethics, education, and policy. By working towards these objectives, we can see how the interdisciplinary field has made (or not made) a collective effort toward promoting responsible AI-filling a gap in the literature that highlights proactive approaches, rather than reactive. In conclusion, this data will inform experts across multiple domains about how to approach and organize a concerted effort to promote ethical and responsible AI in a pragmatic way.",0.07220216606498195
95,Ethics of AI as practical ethics,F. Richter,ieee,10.1109/ISTAS52410.2021.9629163,https://ieeexplore.ieee.org/stamp/stamp.jsp?arnumber=9629163,"Whereas we acknowledge in general certain values as crucial for the ethical debate in AI, like e.g., fairness, transparency, and accountability, these values often can stand in conflict with each other. E.g., more transparency can lead to less privacy. Introducing higher principles to balance the values faces two problematic issues: (1.) Principles also can stand in conflict with each other and defer the discussion into a purely theoretical realm. (2.) If a higher-level principle is introduced and this also stands in conflict with another principle, then a higher-higher-level principle is needed, and we will get into an infinite regress. Although ethics of AI is part of the so-called field of applied ethics and it seems therefore that it is about the application of principles and values and finding the right balance regarding certain ethical theories, e.g., Kantian ethics or utilitarianism ([1][2][3]), the traditional approaches in the field of applied ethics do not offer sufficient conceptual means to deal with practical problems. Thus, the problems that arise from the implementation of intelligent systems can also not be handled adequately, because the same issue as above arises: How can the values be balanced regarding the ethical theories? If higher-level principles are not a viable approach to resolve conflicts of values, the criteria under which they can be implemented should be taken into consideration. Therefore, it is proposed that specific criteria for the implementation of the values need to be made explicit, which will result at least in a clarification for the public debate about certain technological advancements in the field of AI. [4] Furthermore, it is proposed that to resolve these conflicts the implementation must be evaluated, whether it enables human intervention in the future instead of making further actions and interventions impossible.",0.07216494845360824
96,Dignity or degradation: The risks and realities of carebots in Quebec,S. Knappe,ieee,10.1109/ISTAS52410.2021.9629175,https://ieeexplore.ieee.org/stamp/stamp.jsp?arnumber=9629175,"The use of robots in elder care has been a topic of debate in ethics for the last twenty years. Care robots (carebots) present an opportunity to improve health outcomes for those in long term care by facilitating patients’ independence and reducing the workload on caregivers. However, many existing carebot projects have the potential to do harm, both on an individual and societal level. In this paper, the author examines the ethical implications of deploying carebots in the context of Quebec Public Health with a focus of the potential consequences of use in residential and long-term care centers (CHSLDs). The author connects the ethical principles that have been adopted by Quebec Public Health with the ethical discourse surrounding care robots, discusses the way Quebec Public Health adopts technology, then analyzes the relevance of various care robot projects. The result is a set of guidelines for the deployment of carebots in Quebec care homes.",0.0718954248366013
97,On the Ethics of Autonomous and Intelligent Systems (AIS),H. Messer,ieee,10.1109/ICAS49788.2021.9551187,https://ieeexplore.ieee.org/stamp/stamp.jsp?arnumber=9551187,"In the 4th industrial revolution under which autonomous, intelligent systems are designed, certain human brain capacities are delegated to machines. This brings in great opportunity to reduce the need for human intervention in routines of daily lives, together with considerable ethical challenges. The role of the designers of such systems, i.e., engineers, is most important in balancing the opportunities and the challenges. Being a global organization with more than 450,000 members, IEEE took responsibility and has set up the Global Initiative on Ethics of Autonomous and Intelligent Systems, whose mission is: “To ensure every stakeholder involved in the design and development of autonomous and intelligent systems is educated, trained, and empowered to prioritize ethical considerations so that these technologies are advanced for the benefit of humanity.” In this talk I will present the various activities of the global initiative to promote ethics in AIS and, in particular, I will introduce Ethically Aligned Design, First Edition, which is a comprehensive treatise that combines a conceptual framework addressing universal human values, sustainability, data agency, and technical dependability, among other pressing issues with a set of principles to guide A/IS creators and users through a wide-ranging set of recommendations, further resources and reference material, and a painstakingly created glossary. Moreover, users - at all levels - of artificial intelligent systems must be aware of the ethical implications when deciding to use them. Policy makers are responsible for their regulation. But most importantly, designers of AIS systems -engineers - who are the only ones that can control some of the features reflecting on ethical issues (e.g., transparency) must take personal responsibility for the systems they produces to make sure they prioritize ethical considerations so that these technologies are advanced for the benefit of humanity. The way to raise awareness and responsibility is education, and IEEE has a special role in educating present and future engineers in the ethically aligned design of autonomous, intelligent systems.",0.071875
98,"AI Ethics in the Public, Private, and NGO Sectors: A Review of a Global Document Collection",D. Schiff; J. Borenstein; J. Biddle; K. Laas,ieee,10.1109/TTS.2021.3052127,https://ieeexplore.ieee.org/stamp/stamp.jsp?arnumber=9327495,"In recent years, numerous public, private, and non-governmental organizations (NGOs) have produced documents addressing the ethical implications of artificial intelligence (AI). These normative documents include principles, frameworks, and policy strategies that articulate the ethical concerns, priorities, and associated strategies of leading organizations and governments around the world. We examined 112 such documents from 25 countries that were produced between 2016 and the middle of 2019. While other studies identified some degree of consensus in such documents, our work highlights meaningful differences across public, private, and NGO sectors. We analyzed each document in terms of how many of 25 ethical topics were covered and the depth of discussion for those topics. As compared to documents from private entities, NGO and public sector documents reflect more ethical breadth in the number of topics covered, are more engaged with law and regulation, and are generated through processes that are more participatory. These findings may reveal differences in underlying beliefs about an organization's responsibilities, the relative importance of relying on experts versus including representatives from the public, and the tension between prosocial and economic goals.",0.0718232044198895
99,“Resurrecting” dead celebrities: Editing and using remnant data of the deceased through AI,A. Orita,ieee,10.1109/ISTAS55053.2022.10227098,https://ieeexplore.ieee.org/stamp/stamp.jsp?arnumber=10227098,"This paper explores the public perception toward handling remnant data of a celebrity after their death. It attempts to compile or publish these data, aiming to “resurrect” the celebrity through virtual reality (VR) and artificial intelligence (AI). Although such data are used for the memorial of the deceased, their autonomy and privacy preferences regarding the handling of their data must be addressed. Moreover, businesses that use remnant data of the deceased are emerging. This paper presents the results of an online survey conducted with 1,200 participants. The results showed that the percentage of respondents who wanted to utilize the data was low, with most answering “neither” and “don’t know” to questions regarding handling of remnant data of the deceased. In the responses, clear differences were observed based on gender, religion, and age group, with those by respondents in their 20s and 40s being the most distinctive. The methods preferred by the respondents to utilize remnant data varied according to the circumstances of the death and not celebrity type. In the case of predicted deaths, respondents preferred to compile posthumous data, whereas in the case of suicides, they preferred not to resurrect the individual via AI or VR. This indicates that the demand to resurrect celebrities is currently low; however, this may change in the future, and the ethical aspects will need to be considered.",0.07142857142857142
100,What Is a Subliminal Technique? An Ethical Perspective on AI-Driven Influence,J. P. Bermúdez; R. Nyrup; S. Deterding; L. Moradbakhti; C. Mougenot; F. You; R. A. Calvo,ieee,10.1109/ETHICS57328.2023.10155039,https://ieeexplore.ieee.org/stamp/stamp.jsp?arnumber=10155039,"Concerns about threats to human autonomy feature prominently in the field of AI ethics. One aspect of this concern relates to the use of AI systems for problematically manipulative influence. In response to this, the European Union's draft AI Act (AIA) includes a prohibition on AI systems deploying subliminal techniques that alter people's behavior in ways that are reasonably likely to cause harm (Article 5(1)(a)). Critics have argued that the term ‘subliminal techniques’ is too narrow to capture the target cases of AI-based manipulation. We propose a definition of ‘subliminal techniques’ that (a) is grounded on a plausible interpretation of the legal text; (b) addresses all or most of the underlying ethical concerns motivating the prohibition; (c) is defensible from a scientific and philosophical perspective; and (d) does not over-reach in ways that impose excessive administrative and regulatory burdens. The definition provides guidance for design teams seeking to pursue responsible and ethically aligned AI innovation.",0.07096774193548387
101,AI and Blackness: Toward Moving Beyond Bias and Representation,C. L. Dancy; P. K. Saucier,ieee,10.1109/TTS.2021.3125998,https://ieeexplore.ieee.org/stamp/stamp.jsp?arnumber=9606203,"In this article, we argue that AI ethics must move beyond the concepts of race-based representation and bias, and toward those that probe the deeper relations that impact how these systems are designed, developed, and deployed. Many recent discussions on ethical considerations of bias in AI systems have centered on racial bias. We contend that antiblackness in AI requires more of an examination of the ontological space that provides a foundation for the design, development, and deployment of AI systems. We examine what this contention means from the perspective of the sociocultural context in which AI systems are designed, developed, and deployed and focus on intersections with anti-Black racism (antiblackness). To bring these multiple perspectives together and show an example of antiblackness in the face of attempts at de-biasing, we discuss results from auditing an existing open-source semantic network (ConceptNet). We use this discussion to further contextualize antiblackness in design, development, and deployment of AI systems and suggest questions one may ask when attempting to combat antiblackness in AI systems.",0.07058823529411765
102,Human behaviour analysis and face detection using machine learning,A. K. Dohare; M. Sharma; R. S. Pathak,ieee,10.1109/ICAC3N56670.2022.10074045,https://ieeexplore.ieee.org/stamp/stamp.jsp?arnumber=10074045,Human behaviour analysis is a difficult aspect to maintain for a normal human being. This human behaviour analysis is unpredictable generally. The alignment of advanced technology such as machine learning is essential in this context. The machine learning technology plays an important role in structuring all human data and analysis their behavioural pattern considering accuracy and frequency of response. This research has evaluated multiple factors of human behaviour analysis considering its major of utilisation. This research has followed secondary research method based few specific and realistic objectives. An ethical consideration section states the ethical norms that this research has maintained. All the collected data of this research have been analysed considering all research objectives.,0.07017543859649122
103,Ethically Informed Software Process for Smart Health Home,X. Zhang; M. Pike; N. Mustafa; V. Brusic,ieee,10.1109/CBMS55023.2022.00040,https://ieeexplore.ieee.org/stamp/stamp.jsp?arnumber=9867025,"Smart health homes (SHHs) integrate wearable sensors and various interconnected devices using the Internet of Things (IoT) technologies. SHHs combine IoT, data communication, and health-related applications to deliver healthcare services at home. The existing regulations and standards for SHH design are insufficient for home health care. Technical and device standards are available for guiding SHH design and implementation, but ethical standards are lacking. We identified six ethical requirements important for SHH: safety/trust, privacy/data security, vulnerable groups, individual autonomy, transparency/explainability/fairness, and social responsibility/ morality. We identified a set of questions useful for software engineering (SE) process for ethically informed software in SHH design and mapped them to the steps of software process. We mapped related guidelines from relevant professional codes of conduct. These questions can guide ethically informed software process of SHH.",0.06870229007633588
