,Title,Authors,Publisher,DOI,URL,Abstract,Eligibility_Score
236,How Information Technology Literacy Moderated Factors Affecting Quality of Computer-Based Audit,A. S. Lin Lindawati; B. L. Handoko,ieee,10.1109/ICORIS56080.2022.10031571,https://ieeexplore.ieee.org/stamp/stamp.jsp?arnumber=10031571,"The times require auditors to change, auditors no longer carry out the audit process using a manual system, but must switch to computer-based auditing. Especially in the era of the Covid-19 pandemic, which forced auditors to conduct remote audits, which of course had to be computerbased. Our research focuses on what factors can influence computer-based audit quality and what factors can moderate these factors. Our research uses independent variables, namely remote audit implementation, auditor performance and professionalism and in addition to using information technology literacy as a moderating variable. Our research is a quantitative study, using primary data distributed through questionnaires to auditors working in public accounting firms. For statistical data processing, we use the ordinary least square. The results of our study indicate that remote audit implementation, auditor performance and professionalism have a significant effect on computer-based audit quality and information technology literacy is able to moderate and strengthen the influence of these three variables.",0.01282051282051282
237,Dynamic Behavior of Threshold Voltage and  $\textit{I}_{\text{D}}$ – $\textit{V}_{\text{DS}}$  Kink in AlGaN/GaN HEMTs Due to Poole–Frenkel Effect,Z. Gao; C. D. Santi; F. Rampazzo; M. Saro; M. Fornasier; G. Meneghesso; M. Meneghini; A. Chini; G. Verzellesi; E. Zanoni,ieee,10.1109/TED.2023.3326781,https://ieeexplore.ieee.org/stamp/stamp.jsp?arnumber=10302314,"The kink effect in field-effect transistors (FETs) consists in a sudden increase in drain current,  $\textit{I}_{\text{D}}$ , during a drain voltage sweep and leading to a higher  $\textit{I}_{\text{D}}$  saturation value. We report new experimental data concerning the dynamic behavior of the “kink” in AlGaN/GaN HEMTs and correlate them with deep levels. The results demonstrate the role of the Poole–Frenkel effect in determining the occurrence of the kink and identify the experimental conditions that make it observable.",0.012658227848101266
238,Breast Cancer Detection Using Multimodal Time Series Features From Ultrasound Shear Wave Absolute Vibro-Elastography,Y. Shao; H. S. Hashemi; P. Gordon; L. Warren; J. Wang; R. Rohling; S. Salcudean,ieee,10.1109/JBHI.2021.3103676,https://ieeexplore.ieee.org/stamp/stamp.jsp?arnumber=9511105,"In shear wave absolute vibro-elastography (S-WAVE), a steady-state multi-frequency external mechanical excitation is applied to tissue, while a time-series of ultrasound radio-frequency (RF) data are acquired. Our objective is to determine the potential of S-WAVE to classify breast tissue lesions as malignant or benign. We present a new processing pipeline for feature-based classification of breast cancer using S-WAVE data, and we evaluate it on a new data set collected from 40 patients. Novel bi-spectral and Wigner spectrum features are computed directly from the RF time series and are combined with textural and spectral features from B-mode and elasticity images. The Random Forest permutation importance ranking and the Quadratic Mutual Information methods are used to reduce the number of features from 377 to 20. Support Vector Machines and Random Forest classifiers are used with leave-one-patient-out and Monte Carlo cross-validations. Classification results obtained for different feature sets are presented. Our best results (95% confidence interval, Area Under Curve = 95%±1.45%, sensitivity = 95%, and specificity = 93%) outperform the state-of-the-art reported S-WAVE breast cancer classification performance. The effect of feature selection and the sensitivity of the above classification results to changes in breast lesion contours is also studied. We demonstrate that time-series analysis of externally vibrated tissue as an elastography technique, even if the elasticity is not explicitly computed, has promise and should be pursued with larger patient datasets. Our study proposes novel directions in the field of elasticity imaging for tissue classification.",0.012448132780082987
239,Transdisciplinarity as a Learning Challenge: Student Experiences and Outcomes in an Innovative Course on Wearable and Collaborative Robotics,E. Kilic-Bebek; K. Nizamis; M. Vlutters; O. Bebek; Z. G. Karapars; R. Unal; D. Yilmaz; B. Ugurlu,ieee,10.1109/TE.2022.3229201,https://ieeexplore.ieee.org/stamp/stamp.jsp?arnumber=9998574,"Contribution: This study provides evidence for the benefit of short online courses for the transdisciplinary competence development of graduate students. It shows the significant challenges students face while learning, and provides instructional recommendations to improve students’ learning quality and professionalism. Background: Developing wearable and collaborative robots require industry collaboration and transdisciplinary competence. Industry’s involvement in long-term programs is becoming infeasible, and the nature of transdisciplinary learning has not been explored to inform instructional practices. Intended Outcomes: This study aimed to provide instructional recommendations based on an in-depth examination of a diverse group of graduate students’ learning and teamwork experiences as well as outcomes in a 5-day online transdisciplinary course. Application Design: Thirty-one graduate students of engineering, industrial design, and health fields from four countries participated in online mixed-discipline instructional sessions and teams to address a real industry challenge. A mixed-methods approach was used to examine students’ experiences and learning outcomes based on a competence measure, session participation data, student journal entries, team progress reports, team elaboration visuals, and final team presentations. Findings: Students’ knowledge of industrial design, medical considerations, ethics and standards, effective teamwork, and self-regulated learning were increased. Students’ high motivation helped them deal with the challenges involved. Daily student journals, team reports, and visual elaboration tools were found to be beneficial for determining the challenges and learning quality. The observed student progress within five days is promising, making it worthwhile to further explore the benefits of short online courses for increasing graduates’ readiness and establishing university-industry collaborations in education.",0.01195219123505976
240,Noncontact Infant Apnea Detection for Hypoxia Prevention With a K-Band Biomedical Radar,L. Wen; S. Dong; Y. Wang; C. Gu; Z. Tang; Z. Liu; Y. Wang; J. Mao,ieee,10.1109/TBME.2023.3325468,https://ieeexplore.ieee.org/stamp/stamp.jsp?arnumber=10287606,"Annually, a significant number of premature infants suffer from apnea, which can easily cause a drop in oxygen saturation levels, leading to hypoxia. However, infant cardiopulmonary monitoring using conventional methods often necessitates skin contact, and they are not suitable for long-term monitoring. This paper introduces a non-contact technique for infant cardiopulmonary monitoring and an adjustable apnea detection algorithm. These are developed using a custom-designed K-band continuous-wave biomedical radar sensor system, which features a DC-coupled adaptive digital tuning function. By using radar technology to detect chest motions without physical contact, it is feasible to extract significant biological information regarding an infant's respiration and heartbeat. The proposed algorithm utilizes an adaptively adjusted threshold and personalized apnea warning time to automatically measure the total number of apneic events and their respective durations. Experiments have been conducted in clinical environment, demonstrating that both the accurate cardiopulmonary signals and the apneas of varying durations can be effectively monitored using this method, which suggest that the proposed technique has potential applications both inside and outside of clinical settings.",0.011627906976744186
241,Endmember Bundle Extraction Based on Multiobjective Optimization,R. Liu; X. Zhu,ieee,10.1109/TGRS.2020.3037249,https://ieeexplore.ieee.org/stamp/stamp.jsp?arnumber=9268973,"A number of endmember extraction methods have been developed to identify pure pixels in hyperspectral images (HSIs). The majority of them use only one spectrum to represent one kind of material, which ignores the spectral variability problem that particularly characterizes a HSI with high spatial resolution. Only a few algorithms have been developed to identify multiple endmembers representing the spectral variability within each class, called endmember bundle extraction (EBE). This article introduces multiobjective particle swarm optimization for the identification of multiple endmember spectra with variability. Unlike existing convex geometry-based EBE methods, which operate on a single geometry of the dataspace, the proposed method divides the observed data into subsets along the spectral dimension and simultaneously operates on multiple dataspaces to obtain candidate endmembers based on multiobjective particle swarm optimization. The candidate endmembers are then refined by spatial post-processing and sequential forward floating selection to produce the final result. Experiments are conducted on both synthetic and real hyperspectral data to demonstrate the effectiveness of the proposed method in comparison with several state-of-the-art methods.",0.011627906976744186
242,Detecting Changes by Learning No Changes: Data-Enclosing-Ball Minimizing Autoencoders for One-Class Change Detection in Multispectral Imagery,L. Mou; Y. Hua; S. Saha; F. Bovolo; L. Bruzzone; X. X. Zhu,ieee,10.1109/TGRS.2022.3200985,https://ieeexplore.ieee.org/stamp/stamp.jsp?arnumber=9870684,"Change detection is a long-standing and challenging problem in remote sensing. Very often, features about changes are difficult to model beforehand, thus making the collection of changed samples a challenging task. In comparison, it is much easier to collect numerous no-change samples. It is possible to define a change detection approach using only easily available annotated no-change samples, which we henceforth call one-class change detection. Autoencoder networks being trained on no-change data are natural candidates for addressing this task due to their superior performance when compared with other one-class classification models. However, the autoencoders usually suffer from the problem of overgeneralization, i.e., they tend to generalize too well, thus risking properly reconstructing changed samples. In this article, we propose a novel data-enclosing-ball minimizing autoencoder (DebM-AE) that is trained with dual objectives—a reconstruction error criterion and a minimum volume criterion. The network learns a compact latent space, where encodings of no-change samples have low intraclass variance, which as counterpart has the identification of changed instances. We conducted extensive experiments on three real-world datasets. Results demonstrate advantages of the proposed method over other competitors. We make our data and code publicly available (https://gitlab.lrz.de/ai4eo/reasoning/DebM-AE; https://github.com/lcmou/DebM-AE).",0.010416666666666666
243,A Taxonomy of Uncertainty Events in Visual Analytics,C. Gillmann; R. G. C. Maack; F. Raith; J. F. Pérez; G. Scheuermann,ieee,10.1109/MCG.2023.3299297,https://ieeexplore.ieee.org/stamp/stamp.jsp?arnumber=10224065,"Visual analytics (VA) has become a standard tool to process and analyze data visually to generate novel insights. Unfortunately, each component can introduce uncertainty in the visual analytics process. These uncertainty events can originate from many effects and need to be differentiated. In this work, we propose a taxonomy of potential uncertainty events in the visual analytics cycle. Here, we structure the taxonomy along the components included in the visual analytics cycle. Based on this taxonomy, we provide a list of dependencies between these events. At last, we show how to use our taxonomy by providing a real-world example.",0.010101010101010102
244,Inter-Subject Domain Adaptation for CNN-Based Wrist Kinematics Estimation Using sEMG,T. Bao; S. A. R. Zaidi; S. Xie; P. Yang; Z. -Q. Zhang,ieee,10.1109/TNSRE.2021.3086401,https://ieeexplore.ieee.org/stamp/stamp.jsp?arnumber=9446851,"Recently, convolutional neural network (CNN) has been widely investigated to decode human intentions using surface Electromyography (sEMG) signals. However, a pre-trained CNN model usually suffers from severe degradation when testing on a new individual, and this is mainly due to domain shift where characteristics of training and testing sEMG data differ substantially. To enhance inter-subject performances of CNN in the wrist kinematics estimation, we propose a novel regression scheme for supervised domain adaptation (SDA), based on which domain shift effects can be effectively reduced. Specifically, a two-stream CNN with shared weights is established to exploit source and target sEMG data simultaneously, such that domain-invariant features can be extracted. To tune CNN weights, both regression losses and a domain discrepancy loss are employed, where the former enable supervised learning and the latter minimizes distribution divergences between two domains. In this study, eight healthy subjects were recruited to perform wrist flexion-extension movements. Experiment results illustrated that the proposed regression SDA outperformed fine-tuning, a state-of-the-art transfer learning method, in both single-single and multiple-single scenarios of kinematics estimation. Unlike fine-tuning which suffers from catastrophic forgetting, regression SDA can maintain much better performances in original domains, which boosts the model reusability among multiple subjects.",0.010050251256281407
245,Noise Audits Improve Moral Foundation Classification,N. Mokhberian; F. R. Hopp; B. Harandizadeh; F. Morstatter; K. Lerman,ieee,10.1109/ASONAM55673.2022.10068681,https://ieeexplore.ieee.org/stamp/stamp.jsp?arnumber=10068681,"Morality plays an important role in culture, identity, and emotion. Recent advances in natural language processing have shown that it is possible to classify moral values expressed in text at scale. Morality classification relies on human annotators to label the moral expressions in text, which provides training data to achieve state-of-the-art performance. However, these annotations are inherently subjective and some of the instances are hard to classify, resulting in noisy annotations due to error or lack of agreement. The presence of noise in training data harms the classifier's ability to accurately recognize moral foundations from text. We propose two metrics to audit the noise of annotations. The first metric is entropy of instance labels, which is a proxy measure of annotator disagreement about how the instance should be labeled. The second metric is the silhouette coefficient of a label assigned by an annotator to an instance. This metric leverages the idea that instances with the same label should have similar latent representations, and deviations from collective judgments are indicative of errors. Our experiments on three widely used moral foundations datasets show that removing noisy annotations based on the proposed metrics improves classification performance.11Our code can be found at: https://github.com/negar-mokhberian/noise-audits.",0.010050251256281407
246,SAR Tomography via Nonlinear Blind Scatterer Separation,Y. Wang; X. X. Zhu,ieee,10.1109/TGRS.2020.3022209,https://ieeexplore.ieee.org/stamp/stamp.jsp?arnumber=9200699,"Layover separation has been fundamental to many synthetic aperture radar applications, such as building reconstruction and biomass estimation. Retrieving the scattering profile along the mixed dimension (elevation) is typically solved by inversion of the synthetic aperture radar (SAR) imaging model, a process known as SAR tomography. This article proposes a nonlinear blind scatterer separation method to retrieve the phase centers of the layovered scatterers, avoiding the computationally expensive tomographic inversion. We demonstrate that conventional linear separation methods, for example, principle component analysis (PCA), can only partially separate the scatterers under good conditions. These methods produce systematic phase bias in the retrieved scatterers due to the nonorthogonality of the scatterers' steering vectors, especially when the intensities of the sources are similar or the number of images is low. The proposed method artificially increases the dimensionality of the data using kernel PCA, hence mitigating the aforementioned limitations. In the processing, the proposed method sequentially deflates the covariance matrix using the estimate of the brightest scatterer from kernel PCA. Simulations demonstrate the superior performance of the proposed method over conventional PCA-based methods in various respects. Experiments using TerraSAR-X data show an improvement in height reconstruction accuracy by a factor of one to three, depending on the used number of looks.",0.00966183574879227
247,Self-Supervised Multisensor Change Detection,S. Saha; P. Ebel; X. X. Zhu,ieee,10.1109/TGRS.2021.3109957,https://ieeexplore.ieee.org/stamp/stamp.jsp?arnumber=9538396,"Most change detection (CD) methods assume that prechange and postchange images are acquired by the same sensor. However, in many real-life scenarios, e.g., natural disasters, it is more practical to use the latest available images before and after the occurrence of incidence, which may be acquired using different sensors. In particular, we are interested in the combination of the images acquired by optical and synthetic aperture radar (SAR) sensors. SAR images appear vastly different from the optical images even when capturing the same scene. Adding to this, CD methods are often constrained to use only target image-pair, no labeled data, and no additional unlabeled data. Such constraints limit the scope of traditional supervised machine learning and unsupervised generative approaches for multisensor CD. The recent rapid development of self-supervised learning methods has shown that some of them can even work with only few images. Motivated by this, in this work, we propose a method for multisensor CD using only the unlabeled target bitemporal images that are used for training a network in a self-supervised fashion by using deep clustering and contrastive learning. The proposed method is evaluated on four multimodal bitemporal scenes showing change, and the benefits of our self-supervised approach are demonstrated. Code is available at https://gitlab.lrz.de/ai4eo/cd/-/tree/main/sarOpticalMultisensorTgrs2021.",0.00966183574879227
248,Exploring the potential for use of AI to help researchers improve their research funding relevance and performance,O. Spyroglou; C. Yildirim; A. Koumpis,ieee,10.1109/TransAI51903.2021.00025,https://ieeexplore.ieee.org/stamp/stamp.jsp?arnumber=9565634,"Researchers and scientists face globally, and parallel to their core research activities, increased pressure to successfully lead or participate in fundraising activities. The field has been experiencing fierce competition with success rates of proposals falling dramatically down, while the complexity of the funding instruments and the need for acquiring a wide understanding of issues related to impacts, research priorities in connection to wider national and transnational (e.g. EU-wide) policy aspects, increases discomfort levels for the individual researchers and scientists. In the paper we suggest the use of transdisciplinary AI tools to support (semi-)automation of several steps of the application and proposal preparation processes. (Abstract)",0.009615384615384616
249,HTC-DC Net: Monocular Height Estimation From Single Remote Sensing Images,S. Chen; Y. Shi; Z. Xiong; X. X. Zhu,ieee,10.1109/TGRS.2023.3321255,https://ieeexplore.ieee.org/stamp/stamp.jsp?arnumber=10294289,"Three-dimensional geoinformation is of great significance for understanding the living environment; however, 3-D perception from remote sensing data, especially on a large scale, is restricted, mainly due to the high costs of 3-D sensors such as light detection and ranging (LiDAR). To tackle this problem, we propose a method for monocular height estimation from optical imagery, which is currently one of the richest sources of remote sensing data. As an ill-posed problem, monocular height estimation requires well-designed networks for enhanced representations to improve the performance. Moreover, the distribution of height values is long-tailed with the low-height pixels, e.g., the background (BG), as the head, and thus, trained networks are usually biased and tend to underestimate building heights. To solve the problems, instead of formalizing the problem as a regression task, we propose HTC-DC Net following the classification–regression paradigm, with the head-tail cut (HTC) and the distribution-based constraints (DCs) as the main contributions. HTC-DC Net is composed of the backbone network as the feature extractor, the HTC-AdaBins module, and the hybrid regression process. The HTC-AdaBins module serves as the classification phase to determine bins adaptive to each input image. It is equipped with a vision transformer (ViT) encoder to incorporate local context with holistic information and involves an HTC to address the long-tailed problem in monocular height estimation for balancing the performances of foreground (FG) and BG pixels. The hybrid regression process does the regression via the smoothing of bins from the classification phase, which is trained via DCs. The proposed network is tested on three datasets of different resolutions, namely ISPRS Vaihingen (0.09 m), Data Fusion Contest 19 (DFC19) (1.3 m), and Global Building Height (GBH) (3 m). The experimental results show the superiority of the proposed network over existing methods by large margins. Extensive ablation studies demonstrate the effectiveness of each design component. The codes and trained models are published at https://github.com/zhu-xlab/HTC-DC-Net.",0.009584664536741214
250,Exploring Transformer and Multilabel Classification for Remote Sensing Image Captioning,H. Kandala; S. Saha; B. Banerjee; X. X. Zhu,ieee,10.1109/LGRS.2022.3198234,https://ieeexplore.ieee.org/stamp/stamp.jsp?arnumber=9855519,"High-resolution remote sensing images are now available with the progress of remote sensing technology. With respect to popular remote sensing tasks, such as scene classification, image captioning provides comprehensible information about such images by summarizing the image content in human-readable text. Most existing remote sensing image captioning methods are based on deep learning-based encoder–decoder frameworks, using convolutional neural network or recurrent neural network as the backbone of such frameworks. Such frameworks show a limited capability to analyze sequential data and cope with the lack of captioned remote sensing training images. Recently introduced Transformer architecture exploits self-attention to obtain superior performance for sequence-analysis tasks. Inspired by this, in this work, we employ a Transformer as an encoder–decoder for remote sensing image captioning. Moreover, to deal with the limited training data, an auxiliary decoder is used that further helps the encoder in the training process. The auxiliary decoder is trained for multilabel scene classification due to its conceptual similarity to image captioning and capability of highlighting semantic classes. To the best of our knowledge, this is the first work exploiting multilabel classification to improve remote sensing image captioning. Experimental results on the University of California (UC)-Merced caption dataset show the efficacy of the proposed method. The implementation details can be found in https://gitlab.lrz.de/ai4eo/captioningMultilabel.",0.009478672985781991
