,Title,Authors,Publisher,DOI,URL,Abstract,Eligibility_Score
171,Deep Connection: Making Virtual Reality Artworks with Medical Scan Data,M. Oliver; G. J. Joynes; K. Punithakumar; P. Seres,ieee,10.1109/VISAP52981.2021.00011,https://ieeexplore.ieee.org/stamp/stamp.jsp?arnumber=9622912,"Deep Connection is an installation and virtual reality (VR) artwork made using full body 3D and 4D magnetic resonance (MR) scan datasets. When the user enters Deep Connection, they see a scanned body lying prone in mid-air. The user can walk around the body and inspect it, lie underneath and walk through it. The user can dive inside and see its inner workings, its lungs, spine, brain. The user can take hold of the figure’s outstretched hand: holding the hand triggers the 4D dataset, making the heart beat and lungs breathe. When the user lets go the hand, the heart stops beating and the lungs stop breathing. Deep Connection creates a scenario where an embodied human becomes the companion for a virtual body. This paper maps the conceptual and theoretical framework for Deep Connection such as virtual intimacy and digitally mediated companionship. It also reflects on working with scanned bodies more generally in virtual reality by discussing transparency, the cyberbody versus the data body, as well as data privacy and data ethics. The paper also explains the technical and procedural aspects of the Deep Connection project with respect to acquiring scan data for the creation of virtual reality artworks.",0.035175879396984924
172,"Designing the UVA Open Data Initiative: Increasing Engagement for Students, Faculty, Staff Members, and Other Stakeholders",R. Ranjan; K. Lekan; V. Bhaip,ieee,10.1109/SIEDS52267.2021.9483750,https://ieeexplore.ieee.org/stamp/stamp.jsp?arnumber=9483750,"Open data, the distribution of universally available datasets, fosters transparency and accountability to serve the stakeholders of a community. Universities act as hubs of innovation and discovery where any individual can collaborate and freely explore new ideas in their endeavors to better the world. At many universities, including the University of Virginia (UVA), the incongruous communication of data between all stakeholders, and most especially its lack of clarity to students, contributes to student disengagement that threatens to compromise the vision of a transparent and effective university. Open data initiatives at colleges remain an underused tool to target campus improvement and to empower the next generation of civic-minded student leaders. This paper seeks to explore the strengths and needed improvements in current open data principles and projects throughout cities and colleges in the United States. Herein the authors will develop a framework for building an open data initiative at the University of Virginia through evaluating the best practices from similar projects. This research will directly lead into a student-led initiative to develop the Open Data Platform at UVA and will form the foundation of the principles and lessons to be applied at UVA and other similar open data projects elsewhere.",0.035175879396984924
173,Machine vs. human agents in moral dilemmas: evidence from EEG and behavioral data,F. Cassioli; D. Crivelli; M. Balconi,ieee,10.1109/ICECCME55909.2022.9988331,https://ieeexplore.ieee.org/stamp/stamp.jsp?arnumber=9988331,"The future involvement of automated technology in morally-charged decisions is an ethical challenge with relevant consequences. In this study, a task composed of moral dilemmas was employed to assess how participants (n= 34) would evaluate the morality, the consciousness, the responsibility, the intentionality, and the emotional impact of the agent (human vs. machine) and the type of behavior (action vs. inaction). Reaction times (RTs) and electroencephalography (delta, theta, beta, alpha, gamma bands) data were also gathered. Data showed that participants apply different moral rules based on the agent factor, considering humans more moral, responsible, and conscious. The evaluation of the emotional impact derived from human actions was perceived as more severe. Moreover, increased gamma power was found when assessing the intentionality and emotional impact of machines. Higher beta power in the right frontal and frontocentral areas was detected when evaluating the machine's produced emotional impact. An increased right temporal activation was detected when evaluating human agent's emotional impact. Lastly, an alpha desynchronization occurred when evaluating the responsibility of the inaction behavior in the left occipital area. These results might be interpreted as the applications of moral schemata depending on the involved agent, with a possible asymmetry effect in moral judgment.",0.035
174,Detecting Discrimination Risk in Automated Decision-Making Systems with Balance Measures on Input Data,M. Mecati; A. Vetrò; M. Torchiano,ieee,10.1109/BigData52589.2021.9671443,https://ieeexplore.ieee.org/stamp/stamp.jsp?arnumber=9671443,"Bias in the data used to train decision-making systems is a relevant socio-technical issue that emerged in recent years, and it still lacks a commonly accepted solution. Indeed, the ""bias in-bias out"" problem represents one of the most significant risks of discrimination, which encompasses technical fields, as well as ethical and social perspectives. We contribute to the current studies of the issue by proposing a data quality measurement approach combined with risk management, both defined in ISO/IEC standards. For this purpose, we investigate imbalance in a given dataset as a potential risk factor for detecting discrimination in the classification outcome: specifically, we aim to evaluate whether it is possible to identify the risk of bias in a classification output by measuring the level of (im)balance in the input data. We select four balance measures (the Gini, Shannon, Simpson, and Imbalance ratio indexes) and we test their capability to identify discriminatory classification outputs by applying such measures to protected attributes in the training set. The results of this analysis show that the proposed approach is suitable for the goal highlighted above: the balance measures properly detect unfairness of software output, even though the choice of the index has a relevant impact on the detection of discriminatory outcomes, therefore further work is required to test more in-depth the reliability of the balance measures as risk indicators. We believe that our approach for assessing the risk of discrimination should encourage to take more conscious and appropriate actions, as well as to prevent adverse effects caused by the ""bias in-bias out"" problem.",0.03488372093023256
175,Mixed-Method Long-Term Robot Usage: Older Adults' Lived Experience of Social Robots,A. K. Ostrowski; C. Breazeal; H. W. Park,ieee,10.1109/HRI53351.2022.9889488,https://ieeexplore.ieee.org/stamp/stamp.jsp?arnumber=9889488,"In the past two decades, human-robot interaction (HRI) researchers have increasingly deployed autonomous and reliable robots long-term in various social contexts including the home. Our work provides a mixed-method approach for analyzing older adults' long-term robot usage data patterns combining quantitative data of robot usage logs with qualitative descriptions from participants' own experience. Overall, this provides a fuller picture to how older adults use and experience social robots in their homes. Our work involves a robot hosting period for at least a month (up to 12 months) in older adults' homes with an experience debrief session held a month into the robot hosting time period. We propose reflections on the novelty effect with respect to older adults' usage data and highlight feelings of guilt, the robot's proactivity and movement, meeting (or not meeting) user expectations, and the robot's persona as key aspects of the hosting experience that promoted usage or non-usage. Finally, we provide design guidelines for structuring future mixed-method long-term robot usage studies being mindful of ethical considerations in this space.",0.03488372093023256
176,Risk assessment tools on trial: Lessons learned for “Ethical AI” in the criminal justice system,N. Chugh,ieee,10.1109/ISTAS52410.2021.9629143,https://ieeexplore.ieee.org/stamp/stamp.jsp?arnumber=9629143,"In 2018, the Supreme Court decision of Ewert v Canada confirmed that risk assessment tools such as the psychopathy checklists used by Correctional Services of Canada (CSC), failed to account for cultural heritage of the offender, specifically Indigeneity and the impact of colonialism on Canada’s Aboriginal communities. A further review of Canadian case-law post-Ewert reveals that Canadian courts continue their reliance on risk assessment tools despite the critiques from the legal community and from the Supreme Court of Canada. This paper reviews lessons learned from the Canadian experience of Ewert’s challenge of risk assessment tools and to highlight ethical concerns that are being considered in the implementation of artificial intelligence in the criminal justice system.",0.034782608695652174
177,CG-Net: Conditional GIS-Aware Network for Individual Building Segmentation in VHR SAR Images,Y. Sun; Y. Hua; L. Mou; X. X. Zhu,ieee,10.1109/TGRS.2020.3043089,https://ieeexplore.ieee.org/stamp/stamp.jsp?arnumber=9321533,"Object retrieval and reconstruction from very-high-resolution (VHR) synthetic aperture radar (SAR) images are of great importance for urban SAR applications, yet highly challenging due to the complexity of SAR data. This article addresses the issue of individual building segmentation from a single VHR SAR image in large-scale urban areas. To achieve this, we introduce building footprints from geographic information system (GIS) data as a complementary information and propose a novel conditional GIS-aware network (CG-Net). The proposed model learns multilevel visual features and employs building footprints to normalize the features for predicting building masks in the SAR image. We validate our method using a high-resolution spotlight TerraSAR-X image collected over Berlin. Experimental results show that the proposed CG-Net effectively brings improvements with variant backbones. We further compare two representations of building footprints, namely, complete building footprints and sensor-visible footprint segments, for our task, and conclude that the use of the former leads to better segmentation results. Moreover, we investigate the impact of inaccurate GIS data on our CG-Net, and this study shows that CG-Net is robust against positioning errors in the GIS data. In addition, we propose an approach of ground truth generation of buildings from an accurate digital elevation model (DEM), which can be used to generate large-scale SAR image data sets. The segmentation results can be applied to reconstruct 3-D building models at level-of-detail (LoD) 1, which is demonstrated in our experiments.",0.034334763948497854
178,Market Dynamics and Regulation of a Crowd-Sourced AI Marketplace,P. Dhamange; S. Soni; V. Sridhar; S. Rao,ieee,10.1109/ACCESS.2022.3171254,https://ieeexplore.ieee.org/stamp/stamp.jsp?arnumber=9765494,"As usage of artificial intelligence (AI) technologies across industries increases, there is a growing need for creating large marketplaces to host and transact good-quality data sets to train AI algorithms. Our study analyzes the characteristics of such an oligopsony crowdsourced AI Marketplace (AIM) that has a large number of producers and few consumers who transact data sets as per their expectations of price and quality. Using agent-based modeling (ABM), we incorporate heterogeneity in agent attributes and self-learning by the agents that are reflective of real-world marketplaces. Our research augments the existing studies on the effect of and reputation systems in such market places. Extensive simulations using ABM indicate that ratings of the data sets as a feedback mechanism plays an important role in improving the quality of said data sets, and hence the reputations of producers. While such marketplaces are evolving, regulators have started enacting varying rules to oversee the appropriate functioning of such marketplaces, to minimize market distortions. In one of the first such studies, we integrate regulatory interventions in a marketplace model to analyze the impacts of various types of regulations on the functioning of an AIM. Our results indicate that very stringent regulatory measures negatively affect the production of quality data sets in the marketplace. On the other hand, regulatory oversight along with a ratings-based feedback mechanism improves the functioning of an AIM, and hence is recommended for governments and policy makers to adopt.",0.03375527426160337
179,Challenges of Artificial Intelligence in Medicine,N. Nasir; M. Alshabi; N. Al-Yateem; S. A. Rahman; M. A. Subu; H. H. Hijazi; F. R. Ahmed; J. M. Dias; A. Al Marzouqi; M. Y. Alkhawaldeh; M. Eid AbuRuz; A. R. Saifan,ieee,10.1109/COMPSAC57700.2023.00219,https://ieeexplore.ieee.org/stamp/stamp.jsp?arnumber=10197035,"Medical technologies bolstered by AI are quickly developing into viable options for actual clinical use. Wearable, smartphones, and other mobile monitoring sensors are producing vast amounts of data that can be processed by deep learning algorithms in a variety of medical settings. Patients are eager for augmented medicine to be implemented because it will give them more control over their care and allow them to receive more tailored treatment, but doctors are hesitant to embrace the shift because they are not equipped to deal with the resulting changes in clinical practice. In addition, this phenomenon raises the questions of whether or not these cutting-edge tools should be validated by conventional clinical trials, whether or not medical schools should update their curricula to reflect the rise of digital medicine, and whether or not the ethics of constant connected monitoring should be taken into account. The purpose of this paper is to explore the current research literature and offer a holistic view of the implications of well-established clinical applications of artificial intelligence on medical professionals, hospitals, medical schools, and bioethics.",0.033707865168539325
180,Empirical analysis of fairness-aware data segmentation,S. Okura; T. Mohri,ieee,10.1109/ICDMW58026.2022.00029,https://ieeexplore.ieee.org/stamp/stamp.jsp?arnumber=10031167,"Fairness in machine learning is a research area that is recently established, for mitigating bias of unfair models that treat unprivileged people unfavorably based on protected attributes. We want to take an approach for mitigating such bias based on the idea of data segmentation, that is, dividing data into segments where people should be treated similarly. Such an approach should be useful in the sense that the mitigation process itself is explainable for cases that similar people should be treated similarly. Although research on such cases exists, the question of effectiveness of data segmentation itself, however, remains to be answered. In this paper, we answer this question by empirically analyzing the experimental results of data segmentation by using two datasets, i.e., the UCI Adult dataset and the Kaggle ‘Give me some credit’ (gmsc) dataset. We empirically show that (1) fairness can be controllable during training models by the way of dividing data into segments; more specifically, by selecting the attributes and setting the number of segments for adjusting statistics such as statistical parity of the segments and mutual information between the attributes, etc. (2) the effects of data segmentation is dependent on classifiers, and (3) there exist weak trade-offs between fairness and accuracy with regard to data segmentation.",0.03365384615384615
181,Network on Privacy-Aware Audio-and Video-Based Applications for Active and Assisted Living: GoodBrother Project,N. Sklavos; M. Pantopoulou; F. Florez-Revuelta,ieee,10.1109/DSD57027.2022.00105,https://ieeexplore.ieee.org/stamp/stamp.jsp?arnumber=9996851,"Active and Assisted Living (AAL) systems have a purpose to improve the lives of older or impaired people in various aspects. However, the use of equipment for data acquisition in these systems can be considered intrusive in some cases. Although de-identification may provide the needed protection to some extent, it is not always preferred, as it could affect the quality and utility of any obtained data. It is therefore crucial to establish methodologies for protecting the privacy of those monitored and thus affected by AAL systems. The purpose of GoodBrother is to a) analyze any issues arising from the use of monitoring AAL systems, regarding the users' privacy; b) establish proper guidelines for the use of these systems; c) develop privacy-aware methodologies for data handling; d) increase the systems' robustness and reliability; e) create databases to use towards benchmarking. Each one of these objectives are handled by separate interdisciplinary working groups.",0.033112582781456956
182,Visualization of Interval Regression for Facilitating Data and Model Insight,S. Kabir; C. Wagner,ieee,10.1109/FUZZ-IEEE55066.2022.9882717,https://ieeexplore.ieee.org/stamp/stamp.jsp?arnumber=9882717,"With growing significance of interval-valued data, interest in artificial intelligence methods tailored to this data type is similarly increasing across a range of application domains. Here, regression, i.e., the modelling of the association between interval-valued variables has been shown to be both challenging and rewarding. Beyond the mathematical challenges, fundamentals, such as the visualization of regression models, are not similarly available for interval-valued data, limiting both accessibility and utility of resulting models. Recently, the Interval Regression Graph (IRG) was introduced, providing a powerful visualization tool for interval-valued regression models. In this paper, we demonstrate the IRG in a practical data-science application, showing how it can rapidly highlight powerful insights of data. Specifically, we focus on consumer characteristics, analyzing potential relationships between their demographic characteristics and their product purchase intentions. We conclude with a brief outlook on the potential and remaining challenges of leveraging interval-valued data using fuzzy systems and artificial intelligence more broadly.",0.032679738562091505
183,Corrections to “Blending Query Strategy of Active Learning for Imbalanced Data”,G. Kim; C. D. Yoo,ieee,10.1109/ACCESS.2022.3210356,https://ieeexplore.ieee.org/stamp/stamp.jsp?arnumber=9932028,"In the above article [1], the following corrections are necessary. 1)In Table 4, all notions of “MC-Drop-B” are corrected to “MC-Drop-BMP.”2)“Statistical significannces of all experiments are examined” is corrected to “Statistical significance of each experiments is examined.”3)In Appendix II-D, “Shapiro test” is correct to ‘Shapiro-Wilk test.”  In addition, we would like to add the following acknowledgment: The authors appreciate the constructive discussions with Jaewon Lee (M.S. of KAIST), and the cooperation with researchers working on the project [Development and Study of AI Technologies to Inexpensively Conform to Evolving Policy on Ethics].",0.03260869565217391
184,Multisensor Data Fusion for Cloud Removal in Global and All-Season Sentinel-2 Imagery,P. Ebel; A. Meraner; M. Schmitt; X. X. Zhu,ieee,10.1109/TGRS.2020.3024744,https://ieeexplore.ieee.org/stamp/stamp.jsp?arnumber=9211498,"The majority of optical observations acquired via spaceborne Earth imagery are affected by clouds. While there is numerous prior work on reconstructing cloud-covered information, previous studies are, oftentimes, confined to narrowly defined regions of interest, raising the question of whether an approach can generalize to a diverse set of observations acquired at variable cloud coverage or in different regions and seasons. We target the challenge of generalization by curating a large novel data set for training new cloud removal approaches and evaluate two recently proposed performance metrics of image quality and diversity. Our data set is the first publically available to contain a global sample of coregistered radar and optical observations, cloudy and cloud-free. Based on the observation that cloud coverage varies widely between clear skies and absolute coverage, we propose a novel model that can deal with either extreme and evaluate its performance on our proposed data set. Finally, we demonstrate the superiority of training models on real over synthetic data, underlining the need for a carefully curated data set of real observations. To facilitate future research, our data set is made available online.",0.032432432432432434
185,Learning About People's Attitude Towards Food Available in India and Its Implications for Fair AI-based Systems,H. C. Joshi; U. Yadav; B. Srivastava; R. M. Singh,ieee,10.1109/ICDMW58026.2022.00128,https://ieeexplore.ieee.org/stamp/stamp.jsp?arnumber=10031102,"One of the popular notions of fairness from ethics literature envisages that a human requester of products or services should experience equal access to their choices regardless of their background. With food being essential to human survival and core to any economy, the domain has attracted a number of Artificial Intelligence (AI) techniques applied to tasks like food recommendation, recipe creation and food-oriented wellness. We want to explore if such concerns of fairness are appropriate here since food choices have an impact on an individual's health, personal finance and other aspects of life, and thus, any AI introduced here should be responsibly evaluated for not only performance but also non-functional requirements like their impact on users. As a first step towards that goal, in this paper, we want to understand people's perception towards food with respect to their background, and use this as the context to evaluate food-based AI systems in future. Therefore, we conduct the first-of-its-kind survey on perception about food available in India at educational institutes from participants who may associate themselves with different regions within and outside India. We find that users have unequal access to food from different regions today and this may be considered unfair by existing group fairness definitions. Further, we find that many food choices transcend regions, a majority of people prefer food outside their own regions and that usage of digital tools for food is on the rise. The results suggest that AI developers can provide broader and fairer (equal) access by using a mixed strategy of food choices that transcend regions (exploit food data) and also choosing new choices that are region-specific (explore food) dependent on user's regional association.",0.03237410071942446
186,"Evaluation of Conversational Agents: Understanding Culture, Context and Environment in Emotion Detection",M. T. Teye; Y. M. Missah; E. Ahene; T. Frimpong,ieee,10.1109/ACCESS.2022.3153787,https://ieeexplore.ieee.org/stamp/stamp.jsp?arnumber=9718284,"Valuable decisions and highly prioritized analysis now depend on applications such as facial biometrics, social media photo tagging, and human robots interactions. However, the ability to successfully deploy such applications is based on their efficiencies on tested use cases taking into consideration possible edge cases. Over the years, lots of generalized solutions have been implemented to mimic human emotions including sarcasm. However, factors such as geographical location or cultural difference have not been explored fully amidst its relevance in resolving ethical issues and improving conversational AI (Artificial Intelligence). In this paper, we seek to address the potential challenges in the usage of conversational AI within Black African society. We develop an emotion prediction model with accuracies ranging between 85% and 96%. Our model combines both speech and image data to detect the seven basic emotions with a focus on also identifying sarcasm. It uses 3-layers of the Convolutional Neural Network in addition to a new Audio-Frame Mean Expression (AFME) algorithm and focuses on model pre-processing and post-processing stages. In the end, our proposed solution contributes to maintaining the credibility of an emotion recognition system in conversational AIs.",0.03208556149732621
187,"Sketching an AI Marketplace: Tech, Economic, and Regulatory Aspects",A. Kumar; B. Finley; T. Braud; S. Tarkoma; P. Hui,ieee,10.1109/ACCESS.2021.3050929,https://ieeexplore.ieee.org/stamp/stamp.jsp?arnumber=9319656,"Artificial intelligence shows promise for solving many practical societal problems in areas such as healthcare and transportation. However, the current mechanisms for AI model diffusion such as Github code repositories, academic project webpages, and commercial AI marketplaces have some limitations; for example, a lack of monetization methods, model traceability, and model auditabilty. In this work, we sketch guidelines for a new AI diffusion method based on a decentralized online marketplace. We consider the technical, economic, and regulatory aspects of such a marketplace including a discussion of solutions for problems in these areas. Finally, we include a comparative analysis of several current AI marketplaces that are already available or in development. We find that most of these marketplaces are centralized commercial marketplaces with relatively few models.",0.032
