,Title,Authors,Publisher,DOI,URL,Abstract,Eligibility_Score
0,Synthesis of Digital Medical Student Characteristics,M. Srikong; P. Wannapiroon; P. Nilsook,ieee,10.1109/iSTEM-Ed52129.2021.9625123,https://ieeexplore.ieee.org/stamp/stamp.jsp?arnumber=9625123,"The objective of this paper is to study, analyze and synthesize the characteristics of medical students together with digital competencies. It can be concluded that there are 4 characteristics of digital medical students: 1) Digital technology ethics 2) The use of digital technology 3) Creativity, innovation, and digital communication 4) Digital leadership. A compelling visual model is presented that defines the characteristics of medical students needed to become global citizens in the digital era.",0.21621621621621623
1,AI Ethics in Smart Healthcare,S. Pasricha,ieee,10.1109/MCE.2022.3220001,https://ieeexplore.ieee.org/stamp/stamp.jsp?arnumber=9940606,"This article reviews the landscape of ethical challenges of integrating artificial intelligence (AI) into smart healthcare products, including medical electronic devices. Differences between traditional ethics in the medical domain and emerging ethical challenges with AI-driven healthcare are presented, particularly as they relate to transparency, bias, privacy, safety, responsibility, justice, and autonomy. Open challenges and recommendations are outlined to enable the integration of ethical principles into the design, validation, clinical trials, deployment, monitoring, repair, and retirement of AI-based smart healthcare products.",0.2
2,The Concept of Ethical Digital Identities,E. Cioroaica; B. Buhnova; F. Jacobi; D. Schneider,ieee,10.1145/3526073.3527586,https://ieeexplore.ieee.org/stamp/stamp.jsp?arnumber=9808646,"Dynamic changes within the cyberspace are greatly impacting human lives and our societies. Emerging evidence indicates that without an ethical overlook on technological progress, intelligent solutions created to improve and enhance our lives can easily be turned against humankind. In complex AI-socio-technical ecosystems where humans, AI (Artificial Intelligence) and systems interact without a common language for building trust, this paper introduces a methodological concept of Ethical Digital Identities for supporting the ethical evaluation of intelligent digital assets.",0.19480519480519481
3,Why Do Companies Employ Prohibited Unethical Artificial Intelligence Practices?,M. Méndez-Suárez; M. d. l. M. de Obesso; O. C. Márquez; C. M. Palacios,ieee,10.1109/TEM.2023.3258686,https://ieeexplore.ieee.org/stamp/stamp.jsp?arnumber=10084347,"In this article, we investigate the previously unstudied reasons why companies use prohibited artificial intelligence (AI) applications and are punished with large fines under the European General Data Protection Regulation (GDPR). Investigating and understanding why companies engage in such severe AI ethical malpractices is essential to correct them as they seriously jeopardize the future development of AI. Based on a sample of 34 companies, out of which 23 were sanctioned under GDPR due to severe violations of AI ethical principles and using fuzzy-set qualitative comparative analysis, this study demonstrates that to be an AI ethical company and comply with the GDPR regulation, it is necessary to have an AI ethical statement, have a very strong concern for information cybersecurity, and have to be based in a country considered ethical or monitor with care the behavior of the firm in countries with lower ethical standards. As a theoretical contribution, although some authors argue that AI ethical principles are useless, the present research introduces a new theoretical perspective by demonstrating cause–effect relationships between business configurations and AI ethical failures. In addition, the results have an important managerial relevance because they show that lack of an AI ethical statement is the most relevant condition that led to ethical misbehaviors.",0.1941747572815534
4,An Integrated Framework for Ethical and Sustainable Digitalization,I. Wallimann-Helmer; L. Terán; E. Portmann; H. Schübel; J. Pincay,ieee,10.1109/ICEDEG52154.2021.9530972,https://ieeexplore.ieee.org/stamp/stamp.jsp?arnumber=9530972,"Dynamically developing digitization initiatives among public institutions and private companies necessitate a balanced approach to digital ethics. Several frameworks and legal regulations have been adopted to clarify and define the various ethical challenges in digital contexts. These initiatives often accentuate one of three components: data security, data governance, or digital strategy. However, an integrated approach is required to meet the current demand for an ethical and sustainable approach to digitalization and address the growing number of challenges occurring in handling data and related peripheral components. This paper develops the concept of an integrated framework to incorporate all relevant aspects of digital ethics by combining three categories of digital contexts: law and regulations, ethics and justice, and environmental sustainability. The core of this integrated framework, the Fribourg sustainable digital ethics framework (FSDEF), consists of two boundary conditions of sustainable development: social thresholds of justice and ecological planetary boundaries. It also incorporates numerous other frameworks and standards, including value-based engineering and IEEE standards.",0.19254658385093168
5,Exploring Approaches to Artificial Intelligence Governance: From Ethics to Policy,D. Kim; Q. Zhu; H. Eldardiry,ieee,10.1109/ETHICS57328.2023.10155067,https://ieeexplore.ieee.org/stamp/stamp.jsp?arnumber=10155067,"There has been a trend among various stakeholders for AI governance, such as the government, industry, and academia, that advocates for a shift from AI ethics to AI policy. In this paper, we briefly introduce the motivation for such a change and two complementary reports about AI ethics policy development to help AI ethics researchers operationalize abstract AI ethics principles into actionable policy items. We also discuss the implications of the policy approach to AI governance for training the next generation of AI professionals.",0.19047619047619047
6,A Case Study of Privacy Protection Challenges and Risks in AI-Enabled Healthcare App,P. Wang; H. Zare,ieee,10.1109/CAI54212.2023.00132,https://ieeexplore.ieee.org/stamp/stamp.jsp?arnumber=10195065,"Artificial intelligence (AI) is increasingly used in healthcare systems and applications (apps) with questions and debates on ethical issues and privacy risks. This research study explores and discusses the ethical challenges, privacy risks, and possible solutions related to protecting user data privacy in AI-enabled healthcare apps. The study is based on the healthcare app named Charlie in one of the fictional case studies designed by Princeton University to elucidate critical thinking and discussions on emerging ethical issues embracing AI.",0.189873417721519
7,Ethical Chatbot Design for Reducing Negative Effects of Biased Data and Unethical Conversations,J. Bang; S. Kim; J. W. Nam; D. -G. Yang,ieee,10.1109/PlatCon53246.2021.9680760,https://ieeexplore.ieee.org/stamp/stamp.jsp?arnumber=9680760,"AI technology is being introduced into various public and private service domains, transforming existing computing systems or creating new ones. While AI technologies can provide benefits to humans and society, the unexpected consequences (e.g., malfunctions) of AI systems can cause social losses. For this reason, research on ethical design for the development of AI-based systems is becoming important. In this paper, from existing studies on AI ethics, general guidelines such as transparency, explainability, predictability, accountability, fairness, privacy, and control for the ethical design of AI systems are reviewed. And, based on the ethical design guidelines, we discuss ethical design to reduce the negative effects of biased data and unethical dialogues in AI-based conversational chatbots.",0.18421052631578946
8,AI Ethics Impact Assessment based on Requirement Engineering,I. Nitta; K. Ohashi; S. Shiga; S. Onodera,ieee,10.1109/REW56159.2022.00037,https://ieeexplore.ieee.org/stamp/stamp.jsp?arnumber=9920150,"This paper proposes a methodology for evaluating the ethical impact of artificial intelligence (AI) systems on people and society based on AI ethics guidelines. The ethical impact of AI has been recognized as a social issue, and countries and organizations have formulated principles and guidelines on AI ethics, and laws and regulations will be enforced in Europe. Because these principles and guidelines are written in terms of philosophy and law, AI service providers, developers, and business users have the challenge of how they should practice the principles and guidelines to their AI systems. To address this challenge, we first analyzed cases of ethical problems caused by AI in the past and assumed that ethical problems could be linked to interactions between components of AI systems and stakeholders related to such systems. On the basis of this assumption, we then developed a methodology to comprehensively extract the ethical risks that an AI system poses. This methodology consists of two approaches. The first approach is to develop an AI ethics model that embodies ethics guidelines as necessary requirements for ethical AI systems and correlates these requirements with interactions. The second approach is an impact assessment process that uses the AI ethics models to extract ethical risks for individual AI systems. In this paper, we discuss the details of this methodology and show the results of an initial validation to verify the above assumption and the ease of the impact assessment process.",0.18410041841004185
9,Ethical Framework Associated with AI,,ieee,10.1002/9781119831808.ch3,https://ieeexplore.ieee.org/xpl/ebooks/bookPdfWithBanner.jsp?fileName=9823054.pdf&bkn=9820928&pdfType=chapter,"Ethics is a bridge between the innate and the acquired for our social behaviors and our intelligence. The ethics charter promotes the construction of an environmental ethic by introducing fundamental ethical principles that apply to the organization as well as to managers and employees. This charter aims to give all actors involved in artificial intelligence (AI) the ethical, legal and technical foundations useful and necessary for the design, implementation and correct use. The development of AI requires us to invent new knowledge, new know‐how and new ways of living with these new technologies. The chapter focuses on the five stages of ethics, namely ethics of data, ethics of systems, ethics of algorithms, ethics of practice and ethics of decisions. A notable complexity in the health field lies in the direct use by users, without the intervention of health personnel, of certain applications or devices using AI on health data or collecting health data.",0.1830065359477124
10,"Speech Act Theory and Ethics of Speech Processing as Distinct Stages: the ethics of collecting, contextualizing and the releasing of (speech) data",J. Thomas; L. Arya; M. Hussain; S. R. M. Prasanna,ieee,10.1109/ETHICS57328.2023.10154932,https://ieeexplore.ieee.org/stamp/stamp.jsp?arnumber=10154932,"Using speech act theory from the Philosophy of Language, this paper attempts to develop an ethical framework for the phenomenon of speech processing. We use the concepts of the illocutionary force and the illocutionary content of a speech act to explain the ethics of speech processing. By emphasizing the different stages involved in speech processing, we explore the distinct ethical issues that arise in relation to each stage. Input, processing, and output are the different ethically relevant stages under which a spoken item or a speech navigates within the range of speech-processing modules. Employing the illocutionary force-content distinction, we specify and characterize the input-related ethical issues, the output-related ethical issues, and the processing-related ethical issues involved in speech processing. Together with illocutionary force-content distinction, we employ the data-information distinction to characterize the stage-wise ethical issues in the phenomenon of speech processing as the ethics of collecting (speech) data, the ethics of contextualizing (speech) data/information, and the ethics of releasing the con-textualized information (processed speech). Immediate ethical issues that arise from the range of speech processing modules are distinguished from distant ethical issues. We also indicate the nature of ethical issues that arise from Speaker Independent speech technologies.",0.18274111675126903
11,The Contestation of Tech Ethics: A Sociotechnical Approach to Technology Ethics in Practice,B. Green,ieee,10.23919/JSC.2021.0018,https://ieeexplore.ieee.org/stamp/stamp.jsp?arnumber=9684741,"This article introduces the special issue “Technology Ethics in Action: Critical and Interdisciplinary Perspectives”. In response to recent controversies about the harms of digital technology, discourses and practices of “tech ethics” have proliferated across the tech industry, academia, civil society, and government. Yet despite the seeming promise of ethics, tech ethics in practice suffers from several significant limitations: tech ethics is vague and toothless, has a myopic focus on individual engineers and technology design, and is subsumed into corporate logics and incentives. These limitations suggest that tech ethics enables corporate “ethics-washing”: embracing the language of ethics to defuse criticism and resist government regulation, without committing to ethical behavior. Given these dynamics, I describe tech ethics as a terrain of contestation where the central debate is not whether ethics is desirable, but what “ethics” entails and who gets to define it. Current approaches to tech ethics are poised to enable technologists and technology companies to label themselves as “ethical” without substantively altering their practices. Thus, those striving for structural improvements in digital technologies must be mindful of the gap between ethics as a mode of normative inquiry and ethics as a practical endeavor. In order to better evaluate the opportunities and limits of tech ethics, I propose a sociotechnical approach that analyzes tech ethics in light of who defines it and what impacts it generates in practice.",0.17699115044247787
12,An Overview of Artificial Intelligence Ethics,C. Huang; Z. Zhang; B. Mao; X. Yao,ieee,10.1109/TAI.2022.3194503,https://ieeexplore.ieee.org/stamp/stamp.jsp?arnumber=9844014,"Artificial intelligence (AI) has profoundly changed and will continue to change our lives. AI is being applied in more and more fields and scenarios such as autonomous driving, medical care, media, finance, industrial robots, and internet services. The widespread application of AI and its deep integration with the economy and society have improved efficiency and produced benefits. At the same time, it will inevitably impact the existing social order and raise ethical concerns. Ethical issues, such as privacy leakage, discrimination, unemployment, and security risks, brought about by AI systems have caused great trouble to people. Therefore, AI ethics, which is a field related to the study of ethical issues in AI, has become not only an important research topic in academia, but also an important topic of common concern for individuals, organizations, countries, and society. This article will give a comprehensive overview of this field by summarizing and analyzing the ethical risks and issues raised by AI, ethical guidelines and principles issued by different organizations, approaches for addressing ethical issues in AI, and methods for evaluating the ethics of AI. Additionally, challenges in implementing ethics in AI and some future perspectives are pointed out. We hope our work will provide a systematic and comprehensive overview of AI ethics for researchers and practitioners in this field, especially the beginners of this research discipline.",0.17567567567567569
13,Proposed Model of Work Ethics in Artificial Intelligence and Emerging Digital Technologies,S. H. Aldulaimi; M. M. Abdeldayem; M. Y. Abo Keir; M. Abdelhakim,ieee,10.1109/ICETSIS55481.2022.9888900,https://ieeexplore.ieee.org/stamp/stamp.jsp?arnumber=9888900,"The digital revolution witnessed by human civilization and technological development increases the degree of complexity and takes global dimensions, with many challenges and ethical problems. This research deals with digital ethics from a philosophical side, which must be taken into consideration in light of the reign of the digital age in order to solve and avoid emerging ethical problems. The research draws attention to the need to think beyond the facts and theories related to the current standards for the formation of moral awareness. That calls for and emphasizes the need to spread the culture of information and ethics. The findings of this paper led to propose a practical model to imagine the formation of the ethical model in the digital era consisting of several factors.",0.16666666666666666
14,Big Data in Business and Ethical Challenges,N. Zulkarnain; M. Anshari; M. Hamdan; M. Fithriyah,ieee,10.1109/ICIMTech53080.2021.9534963,https://ieeexplore.ieee.org/stamp/stamp.jsp?arnumber=9534963,"Organizations have been adopting Big Data for various purposes and its presence becomes more significant than ever in any public or private sector. However, this adoption comes with its own challenges. Organizations may face or deal with ethical challenges on how they get and utilized data. Because data appears to be easily accessible, ethical compliance in the use of social media data cannot be overlooked. The goal of this research is to see how the phenomena of big data might make ethical decisions more difficult for organizations. This research was built on recent literature reviews, and the discussion intended to examine the extent Big Data application intercepts business ethics, especially on collecting customer data. Hence, Organizations must have transparent policies on big data applications and good practices to promote an ethical culture.",0.16666666666666666
15,A Quantitative Model for the Assessment of Ethics Risks in Information Technology,G. Rafaiani; G. Barchiesi; L. Ilari; M. Baldi; B. Giovanola,ieee,10.1109/ETHICS57328.2023.10155002,https://ieeexplore.ieee.org/stamp/stamp.jsp?arnumber=10155002,"The management of sensitive and personal data in the healthcare sector must guarantee the widest respect of patients' fundamental rights. However, some quantitative evaluation framework for assessing the level of ethical compliance of a technology to the most important ethical principles is still missing. In this work, we first provide a model to quantitatively assess constitutive ethics, i.e., the intrinsic ethical compliance of a technology. Secondly, we propose a method for quantitatively assessing circumstantial ethics risks of a technology, when used in some specific context. Our ethics risk assessment model is based on the evaluation of the compliance of the technology to a defined set of controls about some ethical principles and about the robustness of the technological infrastructure underneath. Then, we validate our model by applying it to some recent healthrelated blockchain frameworks, and we compare a qualitative ethical assessment with the quantitative assessment made with the proposed model for constitutive ethics compliance. Through our assessment, we identify some technical choices that achieve the highest ethical scores, such as using a permissioned blockchain, off-chain storage, and encryption of data. Finally, we observe that the principles of privacy and data governance turn out to be the most satisfied ethical principles, contrary to fairness.",0.1625615763546798
16,What Would You do? An Ethical AI Quiz,W. Teo; Z. Teoh; D. A. Arabi; M. Aboushadi; K. Lai; Z. Ng; A. Pant; R. Hoda; C. Tantithamthavorn; B. Turhan,ieee,10.1109/ICSE-Companion58688.2023.00036,https://ieeexplore.ieee.org/stamp/stamp.jsp?arnumber=10172891,"The resurgence of Artificial Intelligence (AI) has been accompanied by a rise in ethical issues. AI practitioners either face challenges in making ethical choices when designing AI-based systems or are not aware of such challenges in the first place. Increasing the level of awareness and understanding of the perceptions of those who develop AI systems is a critical step toward mitigating ethical issues in AI development. Motivated by these challenges, needs, and the lack of engaging approaches to address these, we developed an interactive, scenario-based ethical AI quiz. It allows AI practitioners, including software engineers who develop AI systems, to self-assess their awareness and perceptions about AI ethics. The experience of taking the quiz, and the feedback it provides, will help AI practitioners understand the gap areas, and improve their overall ethical practice in everyday development scenarios. To demonstrate these expected outcomes and the relevance of our tool, we also share a preliminary user study. The video demo can be found at https://zenodo.org/record/7601169#.Y9xgA-xBxhF.",0.15950920245398773
17,"Bridging Industry, Government, and Academia for Socially Responsible AI: The CSEAI Initiative",P. Rivas; J. Ortiz; D. A. Díaz-Pachón; L. N. Montoya,ieee,10.1109/ETHICS57328.2023.10155071,https://ieeexplore.ieee.org/stamp/stamp.jsp?arnumber=10155071,"The mission of the Center for Standards and Ethics in Artificial Intelligence (CSEAI) is to promote safe, effective, and ethical AI standards through research, outreach, and education in partnership with industry and government. We briefly discuss CSEAI's workforce development plan, including mentoring undergraduate and graduate students and providing continuing education for industry professionals. The CSEAI aims to facilitate the production of standardized, ethical AI products that are safe for users and promote diversity in the field. By underscoring the importance of socially responsible innovation and ethical standards in AI, we show the CSEAI's aims to protect consumers and increase trust in responsible AI products and services.",0.1509433962264151
18,Imagine a More Ethical AI: Using Stories to Develop Teens' Awareness and Understanding of Artificial Intelligence and its Societal Impacts,S. Forsyth; B. Dalton; E. H. Foster; B. Walsh; J. Smilack; T. Yeh,ieee,10.1109/RESPECT51740.2021.9620549,https://ieeexplore.ieee.org/stamp/stamp.jsp?arnumber=9620549,"Artificial intelligence (AI) tools and technologies are increasingly prevalent in society. Many teens interact with AI devices on a daily basis but often have a limited understanding of how AI works, as well as how it impacts society more broadly. It is critical to develop youths' understanding of AI, cultivate ethical awareness, and support diverse youth in pursuing computer science to help ensure future development of more equitable AI technologies. Here, we share our experiences developing and remotely facilitating an interdisciplinary AI ethics program for secondary students designed to increase teens' awareness and understanding of AI and its societal impacts. Students discussed stories with embedded ethical dilemmas, engaged with AI media and simulations, and created digital products to express their stance on an AI ethics issue. Across four iterations in formal and informal settings, we found students to be engaged in AI stories and invested in learning about AI and its societal impacts. Short stories were effective in raising awareness, focusing discussion and supporting students in developing a more nuanced understanding of AI ethics issues, such as fairness, bias and privacy.",0.14917127071823205
19,AI Ethics: Algorithmic Determinism or Self-Determination? The GPDR Approach,M. Milossi; E. Alexandropoulou-Egyptiadou; K. E. Psannis,ieee,10.1109/ACCESS.2021.3072782,https://ieeexplore.ieee.org/stamp/stamp.jsp?arnumber=9400809,"Artificial Intelligence (AI) refers to systems designed by humans, interpreting the already collected data and deciding the best action to take, according to the pre-defined parameters, in order to achieve the given goal. Designing, trial and error while using AI, brought ethics to the center of the dialogue between tech giants, enterprises, academic institutions as well as policymakers. Ethical challenges in AI brought ethical AI framework in place in an attempt to regulate people’s lives and interactions, used for the benefit of society, for the human rights’ protection as well as for the respect of individual’s privacy and autonomy. The paper aims to summarize and critically evaluate the basic principles for the use of AI, with emphasis to the General Data Protection Regulation’s (GDPR) approach, concerning data subject’s consent, data protection principles and data subject’s rights in a context of ‘privacy by design’ architecture.",0.14583333333333334
